РОЛЬФ Премиум – крупнейший официальный дилер Москвы Все автомобили прошли:∙ Криминалистическую и юридическую проверку. ∙ Комплексную диагностику, Вы получаете лист с официальным заключением о состоянии автомобиля.  Дополнительно РОЛЬФ подготовил для Вас 4 акции на данный автомобиль до конца месяца:  Акция №1  Максимально выгодный кредит от 12,5%  Акция №2  ТО в подарок при покупке в кредит автомобиля стоимостью до 2 000 000 руб.  Акция №3  Индивидуальное предложение от Руководителя направления при покупке в кредит автомобиля стоимостью свыше 2 000 000 руб.  Акция №4  Узнайте как вернуть переплату по кредиту.  Мы предлагаем:  ∙ Автокредит от 11,8% по двум документам одобрение за 1 час ∙ Специальные условия при обмене на Ваш автомобиль ∙ В наличии более 500 автомобилей с пробегом ∙ Все автомобили прошли комплексную диагностику ∙ Гарантия юридической чистоты ∙ Более 150 комплектов колес и шин с пробегом по выгодной цене ∙ Широкий ассортимент дополнительного оборудования ∙ Уникальное предложение РОЛЬФ &quot;Авторефинансирование&quot;. ∙ Комиссия. Нашли машину сами - оформите кредит по специальной программе РОЛЬФ ∙ Приводите клиента на свой автомобиль для покупки в кредит в РОЛЬФ Премиум и получите специальный бонус.  РОЛЬФ Премиум – крупнейший официальный дилер Москвы Все автомобили прошли: ∙ Криминалистическую и юридическую проверку.  ∙ Комплексную диагностику, Вы получаете лист с официальным заключением о состоянии автомобиля. Дополнительно РОЛЬФ подготовил для Вас 4 акции на данный автомобиль до конца месяца: Акция №1 Максимально выгодный кредит от 12,5% Акция №2 ТО в подарок при покупке в кредит автомобиля стоимостью до 2 000 000 руб. Акция №3 Индивидуальное предложение от Руководителя направления при покупке в кредит автомобиля стоимостью свыше 2 000 000 руб. Акция №4 Узнайте как вернуть переплату по кредиту.  Мы предлагаем: ∙ Автокредит от 11,8% по двум документам одобрение за 1 час ∙ Специальные условия при обмене на Ваш автомобиль ∙ В наличии более 500 автомобилей с пробегом ∙ Все автомобили прошли комплексную диагностику ∙ Гарантия юридической чистоты ∙ Более 150 комплектов колес и шин с пробегом по выгодной цене ∙ Широкий ассортимент дополнительного оборудования ∙ Уникальное предложение РОЛЬФ  Авторефинансирование . ∙ Комиссия. Нашли машину сами - оформите кредит по специальной программе РОЛЬФ ∙ Приводите клиента на свой автомобиль для покупки в кредит в РОЛЬФ Премиум и получите специальный бонус.  
РОЛЬФ Северо-Запад - это первый мегамолл автомобилей с пробегом, где на площади 27 000 кв.м. вас ждут 1 500 автомобилей с комфортными условиями покупки и выгодными предложениями.  ·       Все автомобили проверены по стандартам РОЛЬФ и заводов-изготовителей ·       Более 50 брендов в различных ценовых категориях ·       Возможность приобретения выбранного автомобиля в кредит (более 10 Банков-партнеров: ЮниКредитБанк, Экспо Банк, Тинькофф Банк, Совкомбанк, Сетелем, Русфинанс Банк, Росгосстрах банк, МС Банк, Локо Банк ,Кредит Европа Банк, ВТБ, Банк УРАЛСИБ, Банк Союз, Банк Зенит, Балтинвестбанк). ·       Любые виды страхования автомобилей ·       Услуги ГИБДД (поставка на учет, прекращение учета, сохранение государственных знаков) ·       Гарантия юридической чистоты и безопасность сделки ·       Гарантия на автомобили различных марок сроком до 24 месяцев при общем пробеге до 200 000 км  Комфортные условия выбора: бесплатный Wi-Fi, уютное кафе с клиентской зоной, большая и удобная парковка Выберите подходящий автомобиль и совершите выгодную покупку в течение 1 дня! От метро Сходненская курсирует бесплатный шаттл-бас  Ждем Вас ежедневно без выходных с 8:00 до 00:00 в РОЛЬФ Северо-Запад, МКАД, 71-й км, 16А, стр. 2  РОЛЬФ Северо-Запад - это первый мегамолл автомобилей с пробегом, где на площади 27 000 кв.м. вас ждут 1 500 автомобилей с комфортными условиями покупки и выгодными предложениями. Только в РОЛЬФ | Северо-Запад выгода до 80 000 рублей, при обмене вашего автомобиля на любой другой с пробегом.*  · Все автомобили проверены по стандартам РОЛЬФ и заводов-изготовителей · Более 50 брендов в различных ценовых категориях · Возможность приобретения выбранного автомобиля в кредит и оформление всех видов страхования · Услуги ГИБДД (поставка на учет, прекращение учета, сохранение государственных знаков) · Гарантия юридической чистоты и безопасность сделки · Гарантия на автомобили различных марок сроком до 24 месяцев при общем пробеге до 200 000 км  Комфортные условия выбора: бесплатный Wi-Fi, уютное кафе с клиентской зоной, большая и удобная парковка От метро Сходненская курсирует бесплатный автобус. Ждем Вас ежедневно без выходных с 8:00 до 00:00 в РОЛЬФ Северо-Запад, МКАД, 71-й км, 16А, стр. 2  РОЛЬФ Северо-Запад - это первый мегамолл автомобилей с пробегом, где на площади 27 000 кв.м. вас ждут 1 500 автомобилей с комфортными условиями покупки и выгодными предложениями. · Все автомобили проверены по стандартам РОЛЬФ и заводов-изготовителей · Более 50 брендов в различных ценовых категориях · Возможность приобретения выбранного автомобиля в кредит (более 10 Банков-партнеров: ЮниКредитБанк, Экспо Банк, Тинькофф Банк, Совкомбанк, Сетелем, Русфинанс Банк, Росгосстрах банк, МС Банк, Локо Банк ,Кредит Европа Банк, ВТБ, Банк УРАЛСИБ, Банк Союз, Банк Зенит, Балтинвестбанк). · Любые виды страхования автомобилей · Услуги ГИБДД (поставка на учет, прекращение учета, сохранение государственных знаков) · Гарантия юридической чистоты и безопасность сделки · Гарантия на автомобили различных марок сроком до 24 месяцев при общем пробеге до 200 000 км Комфортные условия выбора: бесплатный Wi-Fi, уютное кафе с клиентской зоной, большая и удобная парковка Выберите подходящий автомобиль и совершите выгодную покупку в течение 1 дня! От метро Сходненская курсирует бесплатный шаттл-бас Ждем Вас ежедневно без выходных с 8:00 до 00:00 в РОЛЬФ Северо-Запад, МКАД, 71-й км, 16А, стр. 2 РОЛЬФ Северо-Запад - это первый мегамолл автомобилей с пробегом, где на площади 27 000 кв.м. вас ждут 1 500 автомобилей с комфортными условиями покупки и выгодными предложениями. Только в РОЛЬФ | Северо-Запад выгода до 80 000 рублей, при обмене вашего автомобиля на любой другой с пробегом.* · Все автомобили проверены по стандартам РОЛЬФ и заводов-изготовителей · Более 50 брендов в различных ценовых категориях · Возможность приобретения выбранного автомобиля в кредит и оформление всех видов страхования · Услуги ГИБДД (поставка на учет, прекращение учета, сохранение государственных знаков) · Гарантия юридической чистоты и безопасность сделки · Гарантия на автомобили различных марок сроком до 24 месяцев при общем пробеге до 200 000 км Комфортные условия выбора: бесплатный Wi-Fi, уютное кафе с клиентской зоной, большая и удобная парковка От метро Сходненская курсирует бесплатный автобус. Ждем Вас ежедневно без выходных с 8:00 до 00:00 в РОЛЬФ Северо-Запад, МКАД, 71-й км, 16А, стр. 2  
Автомобиль не имеет собственников ( физ. лиц) в ПТС, возможна покупка в лизинг, а так же полный возврат НДС. Цена актуальна до 31 января 2020 г.   Данный автомобиль продается с гарантией «Рольф автомобили с пробегом» уровня GOLD - 24 месяца, либо 200000 км пробега защита от поломок основных узлов и агрегатов по 70 пунктам   РОЛЬФ Премиум – крупнейший официальный дилер Москвы   Все автомобили прошли:   ∙ Криминалистическую и юридическую проверку.  ∙ Комплексную диагностику, Вы получаете лист с официальным заключением о состоянии автомобиля.   Дополнительно РОЛЬФ подготовил для Вас 4 акции на данный автомобиль до конца месяца:   Акция №1   Максимально выгодный кредит от 12,5%   Акция №2   ТО в подарок при покупке в кредит автомобиля стоимостью до 2 000 000 руб.   Акция №3   Индивидуальное предложение от Руководителя направления при покупке в кредит автомобиля стоимостью свыше 2 000 000 руб.   Акция №4   Узнайте как вернуть переплату по кредиту.   Мы предлагаем:   ∙ Автокредит от 11,8% по двум документам одобрение за 1 час  ∙ Специальные условия при обмене на Ваш автомобиль  ∙ В наличии более 500 автомобилей с пробегом  ∙ Все автомобили прошли комплексную диагностику  ∙ Гарантия юридической чистоты  ∙ Более 150 комплектов колес и шин с пробегом по выгодной цене  ∙ Широкий ассортимент дополнительного оборудования  ∙ Уникальное предложение РОЛЬФ &quot;Авторефинансирование&quot;.  ∙ Комиссия. Нашли машину сами - оформите кредит по специальной программе РОЛЬФ  ∙ Приводите клиента на свой автомобиль для покупки в кредит в РОЛЬФ Премиум и получите специальный бонус.  Автомобиль не имеет собственников ( физ. лиц) в ПТС, возможна покупка в лизинг, а так же полный возврат НДС. Цена актуальна до 31 января 2020 г. Данный автомобиль продается с гарантией «Рольф автомобили с пробегом» уровня GOLD - 24 месяца, либо 200000 км пробега защита от поломок основных узлов и агрегатов по 70 пунктам РОЛЬФ Премиум – крупнейший официальный дилер Москвы Все автомобили прошли: ∙ Криминалистическую и юридическую проверку. ∙ Комплексную диагностику, Вы получаете лист с официальным заключением о состоянии автомобиля. Дополнительно РОЛЬФ подготовил для Вас 4 акции на данный автомобиль до конца месяца: Акция №1 Максимально выгодный кредит от 12,5% Акция №2 ТО в подарок при покупке в кредит автомобиля стоимостью до 2 000 000 руб. Акция №3 Индивидуальное предложение от Руководителя направления при покупке в кредит автомобиля стоимостью свыше 2 000 000 руб. Акция №4 Узнайте как вернуть переплату по кредиту. Мы предлагаем: ∙ Автокредит от 11,8% по двум документам одобрение за 1 час ∙ Специальные условия при обмене на Ваш автомобиль ∙ В наличии более 500 автомобилей с пробегом ∙ Все автомобили прошли комплексную диагностику ∙ Гарантия юридической чистоты ∙ Более 150 комплектов колес и шин с пробегом по выгодной цене ∙ Широкий ассортимент дополнительного оборудования ∙ Уникальное предложение РОЛЬФ  Авторефинансирование . ∙ Комиссия. Нашли машину сами - оформите кредит по специальной программе РОЛЬФ ∙ Приводите клиента на свой автомобиль для покупки в кредит в РОЛЬФ Премиум и получите специальный бонус.  Выгода до 120 000 рублей, при  покупке в кредит и обмене на Ваш автомобиль.   Приобретая автомобиль с пробегом «Гарантия РОЛЬФ» на год БЕСПЛАТНО!   Также Вы можете воспользоваться специальными кредитными предложениями при приобретении автомобиля:  + Первоначальный взнос от 0%  + Срок кредита от 6 месяцев до 7 лет  + Выгодные процентные ставки от 13, 5%  + Кредит по двум документам (только паспорт и права) и выдачи кредита в автосалоне одним днем  + ЭКСПРЕСС автокредит, одобрение заявки и выдача автокредита за 2 часа  + Возможность оформления автокредита на себя, а автомобиля на другое лицо  + Возможность досрочного погашения на следующий день  + Возможность оформления в большинстве регионов РФ  + Возможность оформления без военного билета  + Возможность оформления автокредита для работающих пенсионеров (до 85 лет )  + Возможность не сдавать ПТС в банк  Выгода до 120 000 рублей, при покупке в кредит и обмене на Ваш автомобиль. Приобретая автомобиль с пробегом «Гарантия РОЛЬФ» на год БЕСПЛАТНО! Также Вы можете воспользоваться специальными кредитными предложениями при приобретении автомобиля: + Первоначальный взнос от 0% + Срок кредита от 6 месяцев до 7 лет + Выгодные процентные ставки от 13, 5% + Кредит по двум документам (только паспорт и права) и выдачи кредита в автосалоне одним днем + ЭКСПРЕСС автокредит, одобрение заявки и выдача автокредита за 2 часа + Возможность оформления автокредита на себя, а автомобиля на другое лицо + Возможность досрочного погашения на следующий день + Возможность оформления в большинстве регионов РФ + Возможность оформления без военного билета + Возможность оформления автокредита для работающих пенсионеров (до 85 лет ) + Возможность не сдавать ПТС в банк  
Официальный дилер Mercedes-Benz  ООО «РОЛЬФ» филиал «Звезда Столицы Каширка»   • Автокредит от 11,8% по двум документам одобрение за 1 час*  • Специальные условия при обмене на Ваш автомобиль  • В наличии более 200 автомобилей с пробегом  • Все автомобили прошли комплексную диагностику  • Гарантия юридической чистоты  • Более 150 комплектов колес и шин с пробегом по выгодной цене  • Широкий ассортимент дополнительного оборудования   *кредитная ставка зависит от параметров автомобиля, срока кредитования, страхования и размера первоначального взноса  Официальный дилер Mercedes-Benz ООО «РОЛЬФ» филиал «Звезда Столицы Каширка» • Автокредит от 11,8% по двум документам одобрение за 1 час* • Специальные условия при обмене на Ваш автомобиль • В наличии более 200 автомобилей с пробегом • Все автомобили прошли комплексную диагностику • Гарантия юридической чистоты • Более 150 комплектов колес и шин с пробегом по выгодной цене • Широкий ассортимент дополнительного оборудования *кредитная ставка зависит от параметров автомобиля, срока кредитования, страхования и размера первоначального взноса  
